"page","страница"
"женщинам","все для женщин"
"мужчинам","все для мужчин"
"мужчинам джинсы","джинсы мужские"
"мужчинам брюки gant","мужские брюки gant"
"мужчинам джинсы gant","мужские джинсы gant"
"мужчинам кроссовки и кеды gant","мужские кроссовки и кеды gant"
"мужчинам куртки gant","мужские куртки gant"
"мужчинам пиджаки и жакеты gant","мужские пиджаки и жакеты gant"
"мужчинам поло и футболки gant","мужские поло и футболки gant"
"мужчинам ремни gant","мужские ремни gant"
"мужчинам рубашки gant","мужские рубашки gant"
"мужчинам свитера и реглны gant","мужские свитера и реглны gant"
"мужчинам туфли gant","мужские туфли gant"
"мужчинам шорты gant","мужские шорты gant"
"мужчинам туфли barley corn","мужские туфли barley corn"
"мужчинам мокасины и топсайдеры calvin klein","мужские мокасины и топсайдеры calvin klein"
"мужчинам мокасины и топсайдеры colors of california","мужские мокасины и топсайдеры colors of california"
"мужчинам сумки и кошельки dkny","мужские сумки и кошельки dkny"
"мужчинам джинсы g-star raw","мужские джинсы g-star raw"
"мужчинам другие аксессуары  g-star raw","мужские аксессуары g-star raw"
"мужчинам куртки g-star raw","мужские куртки g-star raw"
"мужчинам пиджаки и жакеты g-star raw","мужские пиджаки и жакеты g-star raw"
"мужчинам поло и футболки g-star raw","мужские поло и футболки g-star raw"
"мужчинам ремни g-star raw","мужские ремни g-star raw"
"мужчинам рубашки  g-star raw","мужские рубашки g-star raw"
"мужчинам свитера и регланы g-star raw","мужские свитера и регланы g-star raw"
"мужчинам сумки и кошельки g-star raw","мужские сумки и кошельки g-star raw"
"мужчинам шапки g-star raw","мужские шапки g-star raw"
"мужчинам шарфы и перчатки g-star raw","мужские шарфы и перчатки g-star raw"
"мужчинам шорты g-star raw","мужские шорты g-star raw"
"мужчинам ботинки pepe jeans","мужские ботинки pepe jeans"
"мужчинам брюки pepe jeans","мужские брюки pepe jeans"
"мужчинам вьетнамки и шлепанцы pepe jeans","мужские вьетнамки и шлепанцы pepe jeans"
"мужчинам джинсы pepe jeans","мужские джинсы pepe jeans"
"мужчинам кроссовки и кеды pepe jeans","мужские кроссовки и кеды pepe jeans"
"мужчинам куртки и кеды pepe jeans","мужские куртки pepe jeans"
"мужчинам мокасины и топсайдеры pepe jeans","мужские мокасины и топсайдеры pepe jeans"
"мужчинам поло и футболки pepe jeans","мужские поло и футболки pepe jeans"
"мужчинам рубашки pepe jeans","мужские рубашки pepe jeans"
"мужчинам сандали pepe jeans","мужские сандали pepe jeans"
"мужчинам свитера и регланы pepe jeans","мужские свитера и регланы pepe jeans"
"мужчинам шарфы и перчатки pepe jeans","мужские шарфы и перчатки pepe jeans"
"мужчинам шорты pepe jeans","мужские шорты pepe jeans"
"мужчинам ботинки tommy hilfiger","мужские ботинки tommy hilfiger"
"мужчинам брюки tommy hilfiger","мужские брюки tommy hilfiger"
"мужчинам вьетнамки и шлепанцы tommy hilfiger","мужские вьетнамки и шлепанцы tommy hilfiger"
"мужчинам джинсы tommy hilfiger","мужские джинсы tommy hilfiger"
"мужчинам кепки tommy hilfiger","мужские кепки tommy hilfiger"
"мужчинам кроссовки и кеды tommy hilfiger","мужские кроссовки и кеды tommy hilfiger"
"мужчинам куртки tommy hilfiger","мужские куртки tommy hilfiger"
"мужчинам мокасины и топсайдеры tommy hilfiger","мужские мокасины и топсайдеры tommy hilfiger"
"мужчинам поло и футболки tommy hilfiger","мужские поло и футболки tommy hilfiger"
"мужчинам полотенца и зонты tommy hilfiger","мужские полотенца и зонты tommy hilfiger"
"мужчинам ремни tommy hilfiger","мужские ремни tommy hilfiger"
"мужчинам рубашки tommy hilfiger","мужские рубашки tommy hilfiger"
"мужчинам свитера и регланы tommy hilfiger","мужские свитера и регланы tommy hilfiger"
"мужчинам сумки и кошельки tommy hilfiger","мужские сумки и кошельки tommy hilfiger"
"мужчинам туфли tommy hilfiger","мужские туфли tommy hilfiger"
"мужчинам шапки tommy hilfiger","мужские шапки tommy hilfiger"
"мужчинам шорты tommy hilfiger","мужские шорты tommy hilfiger"
"женщинам cапоги arturo chiang","женские cапоги arturo chiang"
"женщинам босоножки и сандалии bcbg","женские босоножки и сандалии bcbg"
"женщинам вьетнамки и шлепанцы bcbg","женские вьетнамки и шлепанцы bcbg"
"женщинам туфли bcbg","женские туфли bcbg"
"женщинам cапоги calvin klein","женские cапоги calvin klein"
"женщинам босоножки и сандалии colors of california","женские босоножки и сандалии colors of california"
"женщинам вьетнамки и шлепанцы colors of california","женские вьетнамки и шлепанцы colors of california"
"женщинам кроссовки и кеды colors of california","женские кроссовки и кеды colors of california"
"женщинам сумки и клатчи colors of california","женские сумки и клатчи colors of california"
"женщинам cапоги dkny","женские cапоги dkny"
"женщинам балетки dkny","женские балетки dkny"
"женщинам босоножки и сандалии dkny","женские босоножки и сандалии dkny"
"женщинам вьетнамки и шлепанцы dkny","женские вьетнамки и шлепанцы dkny"
"женщинам кошельки dkny","женские кошельки dkny"
"женщинам кроссовки и кеды dkny","женские кроссовки и кеды dkny"
"женщинам сумки и клатчи dkny","женские сумки и клатчи dkny"
"женщинам cапоги fornarina","женские cапоги fornarina"
"женщинам балетки fornarina","женские балетки fornarina"
"женщинам босоножки и сандалии fornarina","женские босоножки и сандалии fornarina"
"женщинам ботинки fornarina","женские ботинки fornarina"
"женщинам брюки fornarina","женские брюки fornarina"
"женщинам джинсы fornarina","женские джинсы fornarina"
"женщинам комбинезоны fornarina","женские комбинезоны fornarina"
"женщинам куртки fornarina","женские куртки fornarina"
"женщинам пальто и плащи fornarina","женские пальто и плащи fornarina"
"женщинам пиджаки и жакеты fornarina","женские пиджаки и жакеты fornarina"
"женщинам платья и сарафаны fornarina","женские платья и сарафаны fornarina"
"женщинам поло и футболки fornarina","женские поло и футболки fornarina"
"женщинам регланы и свитера fornarina","женские регланы и свитера fornarina"
"женщинам ремни fornarina","женские ремни fornarina"
"женщинам рубашки и блузки fornarina","женские рубашки и блузки fornarina"
"женщинам топы и майки fornarina","женские топы и майки fornarina"
"женщинам туфли fornarina","женские туфли fornarina"
"женщинам шорты fornarina","женские шорты fornarina"
"женщинам юбки fornarina","женские юбки fornarina"
"женщинам брюки g-star raw","женские брюки g-star raw"
"женщинам джинсы g-star raw","женские джинсы g-star raw"
"женщинам комбинезоны g-star raw","женские комбинезоны g-star raw"
"женщинам куртки g-star raw","женские куртки g-star raw"
"женщинам леггинсы g-star raw","женские леггинсы g-star raw"
"женщинам пальто и плащи g-star raw","женские пальто и плащи g-star raw"
"женщинам пиджаки и жакеты g-star raw","женские пиджаки и жакеты g-star raw"
"женщинам платья и сарафаны g-star raw","женские платья и сарафаны g-star raw"
"женщинам поло и футболки g-star raw","женские поло и футболки g-star raw"
"женщинам регланы и свитера g-star raw","женские регланы и свитера g-star raw"
"женщинам ремни g-star raw","женские ремни g-star raw"
"женщинам рубашки и блузки g-star raw","женские рубашки и блузки g-star raw"
"женщинам топы и майки g-star raw","женские топы и майки g-star raw"
"женщинам шорты g-star raw","женские шорты g-star raw"
"женщинам cапоги gant","женские cапоги gant"
"женщинам ботинки gant","женские ботинки gant"
"женщинам брюки gant","женские брюки gant"
"женщинам джинсы gant","женские джинсы gant"
"женщинам комбинезоны gant","женские комбинезоны gant"
"женщинам куртки gant","женские куртки gant"
"женщинам пиджаки и жакеты gant","женские пиджаки и жакеты gant"
"женщинам платья и сарафаны gant","женские платья и сарафаны gant"
"женщинам поло и футболки gant","женские поло и футболки gant"
"женщинам регланы и свитера gant","женские регланы и свитера gant"
"женщинам ремни gant","женские ремни gant"
"женщинам рубашки и блузки gant","женские рубашки и блузки gant"
"женщинам топы и майки gant","женские топы и майки gant"
"женщинам шорты gant","женские шорты gant"
"женщинам балетки jessica simpson","женские балетки jessica simpson"
"женщинам босоножки и сандалии jessica simpson","женские босоножки и сандалии jessica simpson"
"женщинам кроссовки и кеды jessica simpson","женские кроссовки и кеды jessica simpson"
"женщинам туфли jessica simpson","женские туфли jessica simpson"
"женщинам балетки lilly's closet","женские балетки lilly's closet"
"женщинам босоножки и сандалии lilly's closet","женские босоножки и сандалии lilly's closet"
"женщинам вьетнамки и шлепанцы lilly's closet","женские вьетнамки и шлепанцы lilly's closet"
"женщинам туфли lilly's closet","женские туфли lilly's closet"
"женщинам cапоги pepe jeans","женские cапоги pepe jeans"
"женщинам босоножки и сандалии pepe jeans","женские босоножки и сандалии pepe jeans"
"женщинам ботинки pepe jeans","женские ботинки pepe jeans"
"женщинам брюки pepe jeans","женские брюки pepe jeans"
"женщинам вьетнамки и шлепанцы pepe jeans","женские вьетнамки и шлепанцы pepe jeans"
"женщинам джинсы pepe jeans","женские джинсы pepe jeans"
"женщинам комбинезоны pepe jeans","женские комбинезоны pepe jeans"
"женщинам кроссовки и кеды pepe jeans","женские кроссовки и кеды pepe jeans"
"женщинам куртки pepe jeans","женские куртки pepe jeans"
"женщинам пиджаки и жакеты pepe jeans","женские пиджаки и жакеты pepe jeans"
"женщинам платья и сарафаны pepe jeans","женские платья и сарафаны pepe jeans"
"женщинам поло и футболки pepe jeans","женские поло и футболки pepe jeans"
"женщинам регланы и свитера pepe jeans","женские регланы и свитера pepe jeans"
"женщинам рубашки и блузки pepe jeans","женские рубашки и блузки pepe jeans"
"женщинам сумки и клатчи pepe jeans","женские сумки и клатчи pepe jeans"
"женщинам топы и майки pepe jeans","женские топы и майки pepe jeans"
"женщинам шарфы и перчатки pepe jeans","женские шарфы и перчатки pepe jeans"
"женщинам шорты pepe jeans","женские шорты pepe jeans"
"женщинам юбки pepe jeans","женские юбки pepe jeans"
"женщинам cапоги tommy hilfiger","женские cапоги tommy hilfiger"
"женщинам балетки tommy hilfiger","женские балетки tommy hilfiger"
"женщинам босоножки и сандалии tommy hilfiger","женские босоножки и сандалии tommy hilfiger"
"женщинам ботинки tommy hilfiger","женские ботинки tommy hilfiger"
"женщинам брюки tommy hilfiger","женские брюки tommy hilfiger"
"женщинам вьетнамки и шлепанцы tommy hilfiger","женские вьетнамки и шлепанцы tommy hilfiger"
"женщинам джинсы tommy hilfiger","женские джинсы tommy hilfiger"
"женщинам другие аксессуары tommy hilfiger","женские аксессуары tommy hilfiger"
"женщинам комбинезоны tommy hilfiger","женские комбинезоны tommy hilfiger"
"женщинам кошельки tommy hilfiger","женские кошельки tommy hilfiger"
"женщинам кроссовки и кеды tommy hilfiger","женские кроссовки и кеды tommy hilfiger"
"женщинам куртки tommy hilfiger","женские куртки tommy hilfiger"
"женщинам мокасины tommy hilfiger","женские мокасины tommy hilfiger"
"женщинам пиджаки и жакеты tommy hilfiger","женские пиджаки и жакеты tommy hilfiger"
"женщинам платья и сарафаны tommy hilfiger","женские платья и сарафаны tommy hilfiger"
"женщинам поло и футболки tommy hilfiger","женские поло и футболки tommy hilfiger"
"женщинам полотенца и зонты tommy hilfiger","женские полотенца и зонты tommy hilfiger"
"женщинам регланы и свитера  tommy hilfiger","женские регланы и свитера tommy hilfiger"
"женщинам ремни tommy hilfiger","женские ремни tommy hilfiger"
"женщинам рубашки и блузки tommy hilfiger","женские рубашки и блузки tommy hilfiger"
"женщинам сумки и клатчи tommy hilfiger","женские сумки и клатчи tommy hilfiger"
"женщинам топы и майки tommy hilfiger","женские топы и майки tommy hilfiger"
"женщинам туфли tommy hilfiger","женские туфли tommy hilfiger"
"женщинам шапки tommy hilfiger","женские шапки tommy hilfiger"
"женщинам шарфы и перчатки tommy hilfiger","женские шарфы и перчатки tommy hilfiger"
"женщинам шорты tommy hilfiger","женские шорты tommy hilfiger"
"женщинам юбки tommy hilfiger","женские юбки tommy hilfiger"
"женщинам балетки vince camuto","женские балетки vince camuto"
"женщинам босоножки и сандалии vince camuto","женские босоножки и сандалии vince camuto"
"женщинам туфли vince camuto","женские туфли vince camuto"

"все g-star raw","продукцию бренда g-star raw"
"все tommy hilfiger","продукцию бренда tommy hilfiger"
"все gant","продукцию бренда gant"
"все 1","продукцию бренда walker"
"все fornarina","продукцию бренда fornarina"
"все pepe jeans","продукцию бренда pepe jeans"
"все arturo chiang","продукцию бренда arturo chiang"
"все barley corn","продукцию бренда barley corn"
"все bcbg","продукцию бренда bcbg"
"все calvin klein","продукцию бренда calvin klein"
"все colors of california","продукцию бренда colors of california"
"все dkny","продукцию бренда dkny"
"все fornarina","продукцию бренда fornarina"
"все jessica simpson","продукцию бренда jessica simpson"
"все lilly's closet","продукцию бренда lilly's closet"
"все vince camuto","продукцию бренда vince camuto"

"женщинам g-star raw","женскую продукцию бренда g-star raw"

"все cапоги","cапоги"
"все балетки","балетки"
"все босоножки и сандалии","босоножки и сандалии"
"все ботинки","ботинки"
"все брюки","брюки"
"все вьетнамки и шлепанцы","вьетнамки и шлепанцы"
"все джинсы","джинсы"
"все другие аксессуары","другие аксессуары"
"все кепки","кепки"
"все комбинезоны","комбинезоны"
"все кошельки","кошельки"
"все кроссовки и кеды","кроссовки и кеды"
"все куртки","куртки"
"все леггинсы","леггинсы"
"все мокасины","мокасины"
"все мокасины и топсайдеры","мокасины и топсайдеры"
"все пальто и плащи","пальто и плащи"
"все пиджаки и жакеты","пиджаки и жакеты"
"все платья и сарафаны","платья и сарафаны"
"все поло и футболки","поло и футболки"
"все полотенца и зонты","полотенца и зонты"
"все регланы и свитера","регланы и свитера"
"все ремни","ремни"
"все рубашки","рубашки"
"все рубашки и блузки","рубашки и блузки"
"все сандалі","сандалі"
"все свитера и регланы","свитера и регланы"
"все сумки и клатчи","сумки и клатчи"
"все сумки и кошельки","сумки и кошельки"
"все топы и майки","топы и майки"
"все туфли","туфли"
"все шапки","шапки"
"все шарфы и перчатки","шарфы и перчатки"
"все шорты","шорты"
"все юбки","юбки"

"все женщинам одежда fornarina","женскую одежду fornarina"
"все женщинам одежда g-star raw","женскую одежду g-star raw"
"все женщинам одежда gant","женскую одежду gant"
"все женщинам одежда pepe jeans","женскую одежду pepe jeans"
"все женщинам одежда tommy hilfiger","женскую одежду tommy hilfiger"

"все женщинам обувь arturo chiang","женскую обувь arturo chiang"
"все женщинам обувь bcbg","женскую обувь bcbg"
"все женщинам обувь calvin klein","женскую обувь calvin klein"
"все женщинам обувь colors of california","женскую обувь colors of california"
"все женщинам обувь dkny","женскую обувь dkny"
"все женщинам обувь fornarina","женскую обувь fornarina"
"все женщинам обувь gant","женскую обувь gant"
"все женщинам обувь jessica simpson","женскую обувь jessica simpson"
"все женщинам обувь lilly's closet","женскую обувь lilly's closet"
"все женщинам обувь pepe jeans","женскую обувь pepe jeans"
"все женщинам обувь tommy hilfiger","женскую обувь tommy hilfiger"
"все женщинам обувь vince camuto","женскую обувь vince camuto"

"все женщинам аксессуары colors of california","женские аксессуары colors of california"
"все женщинам аксессуары dkny","женские аксессуары dkny"
"все женщинам аксессуары fornarina","женские аксессуары fornarina"
"все женщинам аксессуары g-star raw","женские аксессуары g-star raw"
"все женщинам аксессуары gant","женские аксессуары gant"
"все женщинам аксессуары pepe jeans","женские аксессуары pepe jeans"
"все женщинам аксессуары tommy hilfiger","женские аксессуары tommy hilfiger"

"все мужчинам одежда g-star raw","мужскую одежду g-star raw"
"все мужчинам одежда gant","мужскую одежду gant"
"все мужчинам одежда pepe jeans","мужскую одежду pepe jeans"
"все мужчинам одежда tommy hilfiger","мужскую одежду tommy hilfiger"

"все мужчинам аксессуары dkny","мужские аксессуары dkny"
"все мужчинам аксессуары g-star raw","мужские аксессуары g-star raw"
"все мужчинам аксессуары gant","мужские аксессуары gant"
"все мужчинам аксессуары pepe jeans","мужские аксессуары pepe jeans"
"все мужчинам аксессуары tommy hilfiger","мужские аксессуары tommy hilfiger"

"все мужчинам обувь barley corn","мужскую обувь barley corn"
"все мужчинам обувь calvin klein","мужскую обувь calvin klein"
"все мужчинам обувь colors of california","мужскую обувь colors of california"
"все мужчинам обувь gant","мужскую обувь gant"
"все мужчинам обувь pepe jeans","мужскую обувь pepe jeans"
"все мужчинам обувь tommy hilfiger","мужскую обувь tommy hilfiger"

"мужчинам ботинки","мужские ботинки"
"мужчинам брюки","мужские брюки"
"мужчинам вьетнамки и шлепанцы","мужские вьетнамки и шлепанцы"
"мужчинам джинсы","мужские джинсы"
"мужчинам другие аксессуары","мужские другие аксессуары"
"мужчинам кепки","мужские кепки"
"мужчинам кроссовки и кеды","мужские кроссовки и кеды"
"мужчинам куртки","мужские куртки"
