"page","page"
"women","women's products"
"men","men's products"
"men jeans","men's jeans"
"women boots arturo chiang","women's boots arturo chiang"
"women flip-flops and slippers bcbg","women's flip-flops and slippers bcbg"
"women sandals bcbg","women's sandals bcbg"
"women shoes bcbg","women's shoes bcbg"
"women boots calvin klein","women's boots calvin klein"
"women bags and clutches colors of california","women's bags and clutches colors of california"
"women ballet colors of california","women's ballet colors of california"
"women flip-flops and slippers colors of california","women's flip-flops and slippers colors of california"
"women sandals colors of california","women's sandals colors of california"
"women sneakers shoes colors of california","women's sneakers shoes colors of california"
"women bags and clutches dkny","women's bags and clutches dkny"
"women ballet dkny","women's ballet dkny"
"women boots dkny","women's boots dkny"
"women flip-flops and slippers dkny","women's flip-flops and slippers dkny"
"women purses dkny","women's purses dkny"
"women sandals dkny","women's sandals dkny"
"women sneakers shoes dkny","women's sneakers shoes dkny"
"women blazers and jackets fornarina","women's blazers and jackets fornarina"
"women ballet fornarina","women's ballet fornarina"
"women belts fornarina","women's belts fornarina"
"women boots fornarina","women's boots fornarina"
"women coats and raincoats fornarina","women's coats and raincoats fornarina"
"women dresses and tunics fornarina","women's dresses and tunics fornarina"
"women jackets fornarina","women's jackets fornarina"
"women jeans fornarina","women's jeans fornarina"
"women overalls fornarina","women's overalls fornarina"
"women pants fornarina","women's pants fornarina"
"women polo and t-shirts fornarina","women's polo and t-shirts fornarina"
"women raglan and sweaters fornarina","women's raglan and sweaters fornarina"
"women sandals fornarina","women's sandals fornarina"
"women shirts and blouses fornarina","women's shirts and blouses fornarina"
"women shoes fornarina","women's shoes fornarina"
"women shorts fornarina","women's shorts fornarina"
"women skirts fornarina","women's skirts fornarina"
"women tops and shirts fornarina","women's tops and shirts fornarina"
"women blazers and jackets g-star raw","women's blazers and jackets g-star raw"
"women belts g-star raw","women's belts g-star raw"
"women coats and raincoats g-star raw","women's coats and raincoats g-star raw"
"women dresses and tunics g-star raw","women's dresses and tunics g-star raw"
"women jackets g-star raw","women's jackets g-star raw"
"women jeans g-star raw","women's jeans g-star raw"
"women leg³nsi g-star raw","women's leg³nsi g-star raw"
"women overalls g-star raw","women's overalls g-star raw"
"women pants g-star raw","women's pants g-star raw"
"women polo and t-shirts g-star raw","women's polo and t-shirts g-star raw"
"women raglan and sweaters g-star raw","women's raglan and sweaters g-star raw"
"women shirts and blouses g-star raw","women's shirts and blouses g-star raw"
"women shorts g-star raw","women's shorts g-star raw"
"women tops and shirts g-star raw","women's tops and shirts g-star raw"
"women blazers and jackets gant","women's blazers and jackets gant"
"women belts gant","women's belts gant"
"women boots gant","women's boots gant"
"women boots gant","women's boots gant"
"women dresses and tunics gant","women's dresses and tunics gant"
"women jackets gant","women's jackets gant"
"women jeans gant","women's jeans gant"
"women overalls gant","women's overalls gant"
"women pants gant","women's pants gant"
"women polo and t-shirts gant","women's polo and t-shirts gant"
"women raglan and sweaters gant","women's raglan and sweaters gant"
"women shirts and blouses gant","women's shirts and blouses gant"
"women shorts gant","women's shorts gant"
"women tops and shirts gant","women's tops and shirts gant"
"women ballet jessica simpson","women's ballet jessica simpson"
"women sandals simpson","women's sandals simpson"
"women shoes simpson","women's shoes simpson"
"women sneakers shoes simpson","women's sneakers shoes simpson"
"women ballet lilly's closet","women's ballet lilly's closet"
"women flip-flops and slippers lilly's closet","women's flip-flops and slippers lilly's closet"
"women sandals lilly's closet","women's sandals lilly's closet"
"women shoes lilly's closet","women's shoes lilly's closet"
"women blazers and jackets pepe jeans","women's blazers and jackets pepe jeans"
"women bags and clutches pepe jeans","women's bags and clutches pepe jeans"
"women boots pepe jeans","women's boots pepe jeans"
"women dresses and tunics pepe jeans","women's dresses and tunics pepe jeans"
"women flip-flops and slippers pepe jeans","women's flip-flops and slippers pepe jeans"
"women jackets pepe jeans","women's jackets pepe jeans"
"women jeans pepe jeans","women's jeans pepe jeans"
"women overalls pepe jeans","women's overalls pepe jeans"
"women pants pepe jeans","women's pants pepe jeans"
"women polo and t-shirts pepe jeans","women's polo and t-shirts pepe jeans"
"women raglan and sweaters pepe jeans","women's raglan and sweaters pepe jeans"
"women sandals pepe jeans","women's sandals pepe jeans"
"women scarves and gloves pepe jeans","women's scarves and gloves pepe jeans"
"women shirts and blouses pepe jeans","women's shirts and blouses pepe jeans"
"women shorts pepe jeans","women's shorts pepe jeans"
"women skirts pepe jeans","women's skirts pepe jeans"
"women sneakers shoes pepe jeans","women's sneakers shoes pepe jeans"
"women tops and shirts pepe jeans","women's tops and shirts pepe jeans"
"women blazers and jackets tommy hilfiger","women's blazers and jackets tommy hilfiger"
"women bags and clutches tommy hilfiger","women's bags and clutches tommy hilfiger"
"women ballet tommy hilfiger","women's ballet tommy hilfiger"
"women belts tommy hilfiger","women's belts tommy hilfiger"
"women boots tommy hilfiger","women's boots tommy hilfiger"
"women dresses and tunics tommy hilfiger","women's dresses and tunics tommy hilfiger"
"women flip-flops and slippers tommy hilfiger","women's flip-flops and slippers tommy hilfiger"
"women hats tommy hilfiger","women's hats tommy hilfiger"
"women jackets tommy hilfiger","women's jackets tommy hilfiger"
"women jeans tommy hilfiger","women's jeans tommy hilfiger"
"women moccasins tommy hilfiger","women's moccasins tommy hilfiger"
"women other accessories tommy hilfiger","women's other accessories tommy hilfiger"
"women overalls tommy hilfiger","women's overalls tommy hilfiger"
"women pants tommy hilfiger","women's pants tommy hilfiger"
"women polo and t-shirts tommy hilfiger","women's polo and t-shirts tommy hilfiger"
"women purses tommy hilfiger","women's purses tommy hilfiger"
"women raglan and sweaters tommy hilfiger","women's raglan and sweaters tommy hilfiger"
"women sandals tommy hilfiger","women's sandals tommy hilfiger"
"women scarves and gloves tommy hilfiger","women's scarves and gloves tommy hilfiger"
"women shirts and blouses tommy hilfiger","women's shirts and blouses tommy hilfiger"
"women shoes tommy hilfiger","women's shoes tommy hilfiger"
"women shorts tommy hilfiger","women's shorts tommy hilfiger"
"women skirts tommy hilfiger","women's skirts tommy hilfiger"
"women sneakers shoes tommy hilfiger","women's sneakers shoes tommy hilfiger"
"women tops and shirts tommy hilfiger","women's tops and shirts tommy hilfiger"
"women towels and umbrellas tommy hilfiger","women's towels and umbrellas tommy hilfiger"
"women ballet vince camuto","women's ballet vince camuto"
"women sandals vince camuto","women's sandals vince camuto"
"women shoes vince camuto","women's shoes vince camuto"

"men shoes barley corn","men's shoes barley corn"
"men moccasins and topsaydery calvin klein","men's moccasins and topsaydery calvin klein"
"men moccasins and topsaydery colors of california","men's moccasins and topsaydery colors of california"
"men bags and purses dkny","men's bags and purses dkny"
"men blazers and jackets g-star raw","men's blazers and jackets g-star raw"
"men bags and purses g-star raw","men's bags and purses g-star raw"
"men belts g-star raw","men's belts g-star raw"
"men hats g-star raw","men's hats g-star raw"
"men jackets g-star raw","men's jackets g-star raw"
"men jeans g-star raw","men's jeans g-star raw"
"men other accessories g-star raw","men's other accessories g-star raw"
"men polo and t-shirts g-star raw","men's polo and t-shirts g-star raw"
"men scarves and gloves g-star raw","men's scarves and gloves g-star raw"
"men shirts g-star raw","men's shirts g-star raw"
"men shorts g-star raw","men's shorts g-star raw"
"men sweaters and jerseys g-star raw","men's sweaters and jerseys g-star raw"
"men blazers and jackets gant","men's blazers and jackets gant"
"men belts gant","men's belts gant"
"men jackets gant","men's jackets gant"
"men jeans gant","men's jeans gant"
"men pants gant","men's pants gant"
"men polo and t-shirts gant","men's polo and t-shirts gant"
"men shirts gant","men's shirts gant"
"men shoes gant","men's shoes gant"
"men shorts gant","men's shorts gant"
"men sneakers shoes gant","men's sneakers shoes gant"
"men sweaters and jerseys gant","men's sweaters and jerseys gant"
"men boots pepe jeans","men's boots pepe jeans"
"men boots pepe jeans","men's boots pepe jeans"
"men flip-flops and slippers pepe jeans","men's flip-flops and slippers pepe jeans"
"men jackets pepe jeans","men's jackets pepe jeans"
"men jeans pepe jeans","men's jeans pepe jeans"
"men moccasins and topsaydery pepe jeans","men's moccasins and topsaydery pepe jeans"
"men pants pepe jeans","men's pants pepe jeans"
"men polo and t-shirts pepe jeans","men's polo and t-shirts pepe jeans"
"men scarves and gloves pepe jeans","men's scarves and gloves pepe jeans"
"men shirts pepe jeans","men's shirts pepe jeans"
"men shorts pepe jeans","men's shorts pepe jeans"
"men sneakers shoes pepe jeans","men's sneakers shoes pepe jeans"
"men sweaters and jerseys pepe jeans","men's sweaters and jerseys pepe jeans"
"men bags and purses tommy hilfiger","men's bags and purses tommy hilfiger"
"men belts tommy hilfiger","men's belts tommy hilfiger"
"men boots tommy hilfiger","men's boots tommy hilfiger"
"men caps tommy hilfiger","men's caps tommy hilfiger"
"men flip-flops and slippers tommy hilfiger","men's flip-flops and slippers tommy hilfiger"
"men hats tommy hilfiger","men's hats tommy hilfiger"
"men jackets tommy hilfiger","men's jackets tommy hilfiger"
"men jeans tommy hilfiger","men's jeans tommy hilfiger"
"men moccasins and topsaydery tommy hilfiger","men's moccasins and topsaydery tommy hilfiger"
"men pants tommy hilfiger","men's pants tommy hilfiger"
"men polo and t-shirts tommy hilfiger","men's polo and t-shirts tommy hilfiger"
"men shirts tommy hilfiger","men's shirts tommy hilfiger"
"men shoes tommy hilfiger","men's shoes tommy hilfiger"
"men shorts tommy hilfiger","men's shorts tommy hilfiger"
"men sneakers shoes tommy hilfiger","men's sneakers shoes tommy hilfiger"
"men sweaters and jerseys tommy hilfiger","men's sweaters and jerseys tommy hilfiger"
"men towels and umbrellas tommy hilfiger","men's towels and umbrellas tommy hilfiger"

"all tommy hilfiger","tommy hilfiger products"
"all g-star raw","g-star raw products"
"all gant","gant products"
"all 1 brand","walker products"
"all fornarina","fornarina products"
"all pepe jeans","pepe jeans products"
"all arturo chiang","arturo chiang products"
"all barley corn","barley corn products"
"all bcbg","bcbg products"
"all calvin klein","calvin klein products"
"all colors of california","colors of california products"
"all dkny","dkny products"
"all fornarina","fornarina products"
"all jessica simpson","jessica simpson products"
"all lilly's closet","lilly's closet products"
"all vince camuto","vince camuto products"

"all women clothing","women's clothing"
"all women footwear","women's footwear"
"all women accessories","women's accessories"

"all men clothing","men's clothing"
"all men accessories","men's accessories"
"all men footwear","men's footwear"

"women blazers and jackets","women's blazers and jackets"
"women bags and clutches","women's bags and clutches"
"women ballet","women's ballet"
"women belts","women's belts"
"women boots","women's boots"
"women boots","women's boots"
"women coats and raincoats","women's coats and raincoats"
"women dresses and tunics","women's dresses and tunics"
"women flip-flops and slippers","women's flip-flops and slippers"
"women hats","women's hats"
"women jackets","women's jackets"
"women jeans","women's jeans"
"women leg³nsi","women's leg³nsi"
"women moccasins","women's moccasins"
"women other accessories","women's other accessories"
"women overalls","women's overalls"
"women pants","women's pants"
"women polo and t-shirts","women's polo and t-shirts"
"women purses","women's purses"
"women raglan and sweaters","women's raglan and sweaters"
"women sandals","women's sandals"
"women scarves and gloves","women's scarves and gloves"
"women shirts and blouses","women's shirts and blouses"
"women shoes","women's shoes"
"women shorts","women's shorts"
"women skirts","women's skirts"
"women sneakers shoes","women's sneakers shoes"
"women tops and shirts","women's tops and shirts"
"women towels and umbrellas","women's towels and umbrellas"

"men blazers and jackets","men's blazers and jackets"
"men bags and purses","men's bags and purses"
"men belts","men's belts"
"men boots","men's boots"
"men caps","men's caps"
"men flip-flops and slippers","men's flip-flops and slippers"
"men hats","men's hats"
"men jackets","men's jackets"
"men jeans","men's jeans"
"men moccasins and topsaydery","men's moccasins and topsaydery"
"men other accessories","men's other accessories"
"men pants","men's pants"
"men polo and t-shirts","men's polo and t-shirts"
"men scarves and gloves","men's scarves and gloves"
"men shirts","men's shirts"
"men shoes","men's shoes"
"men shorts","men's shorts"
"men sneakers shoes","men's sneakers shoes"
"men sweaters and jerseys","men's sweaters and jerseys"
"men towels and umbrellas","men's towels and umbrellas"
"men sandals","men's sandals"

"women female","all women"
"men male","all men"

"all women","women's products"
"all men","men's products"